check RAID...
*** Active Set
name   : nvidia_eehcaejf
size   : 976773120
stride : 128
type   : mirror
status : ok
subsets: 0
devs   : 2
spares : 0
/dev/sdb: nvidia, "nvidia_eehcaejf", mirror, ok, 976773166 sectors, data@ 0
/dev/sda: nvidia, "nvidia_eehcaejf", mirror, ok, 976773166 sectors, data@ 0


check storage...
Filesystem           1K-blocks      Used Available Use% Mounted on
/dev/mapper/usclx0002-root
                     469079536  56944420 388307252  13% /
tmpfs                  1967608         0   1967608   0% /lib/init/rw
varrun                 1967608      1100   1966508   1% /var/run
varlock                1967608         0   1967608   0% /var/lock
udev                   1967608       136   1967472   1% /dev
tmpfs                  1967608         0   1967608   0% /dev/shm
lrm                    1967608      2560   1965048   1% /lib/modules/2.6.28-19-server/volatile
/dev/mapper/nvidia_eehcaejf5
                        233335     99602    121285  46% /boot


check S.M.A.R.T.T...
smartctl version 5.38 [x86_64-unknown-linux-gnu] Copyright (C) 2002-8 Bruce Allen
Home page is http://smartmontools.sourceforge.net/

=== START OF INFORMATION SECTION ===
Device Model:     WDC WD5000AADS-00L4B1
Serial Number:    WD-WCAUK1180292
Firmware Version: 05.04C05
User Capacity:    500,107,862,016 bytes
Device is:        Not in smartctl database [for details use: -P showall]
ATA Version is:   8
ATA Standard is:  Exact ATA specification draft version not indicated
Local Time is:    Mon May 30 06:45:01 2011 CEST
SMART support is: Available - device has SMART capability.
SMART support is: Enabled

=== START OF READ SMART DATA SECTION ===
SMART overall-health self-assessment test result: PASSED

General SMART Values:
Offline data collection status:  (0x84)	Offline data collection activity
					was suspended by an interrupting command from host.
					Auto Offline Data Collection: Enabled.
Self-test execution status:      (   0)	The previous self-test routine completed
					without error or no self-test has ever 
					been run.
Total time to complete Offline 
data collection: 		 (11400) seconds.
Offline data collection
capabilities: 			 (0x7b) SMART execute Offline immediate.
					Auto Offline data collection on/off support.
					Suspend Offline collection upon new
					command.
					Offline surface scan supported.
					Self-test supported.
					Conveyance Self-test supported.
					Selective Self-test supported.
SMART capabilities:            (0x0003)	Saves SMART data before entering
					power-saving mode.
					Supports SMART auto save timer.
Error logging capability:        (0x01)	Error logging supported.
					General Purpose Logging supported.
Short self-test routine 
recommended polling time: 	 (   2) minutes.
Extended self-test routine
recommended polling time: 	 ( 133) minutes.
Conveyance self-test routine
recommended polling time: 	 (   5) minutes.
SCT capabilities: 	       (0x303f)	SCT Status supported.
					SCT Feature Control supported.
					SCT Data Table supported.

SMART Attributes Data Structure revision number: 16
Vendor Specific SMART Attributes with Thresholds:
ID# ATTRIBUTE_NAME          FLAG     VALUE WORST THRESH TYPE      UPDATED  WHEN_FAILED RAW_VALUE
  1 Raw_Read_Error_Rate     0x002f   200   200   051    Pre-fail  Always       -       0
  3 Spin_Up_Time            0x0027   137   134   021    Pre-fail  Always       -       6150
  4 Start_Stop_Count        0x0032   100   100   000    Old_age   Always       -       52
  5 Reallocated_Sector_Ct   0x0033   200   200   140    Pre-fail  Always       -       0
  7 Seek_Error_Rate         0x002e   200   200   000    Old_age   Always       -       0
  9 Power_On_Hours          0x0032   088   088   000    Old_age   Always       -       9395
 10 Spin_Retry_Count        0x0032   100   253   000    Old_age   Always       -       0
 11 Calibration_Retry_Count 0x0032   100   253   000    Old_age   Always       -       0
 12 Power_Cycle_Count       0x0032   100   100   000    Old_age   Always       -       50
192 Power-Off_Retract_Count 0x0032   200   200   000    Old_age   Always       -       4
193 Load_Cycle_Count        0x0032   200   200   000    Old_age   Always       -       52
194 Temperature_Celsius     0x0022   110   104   000    Old_age   Always       -       37
196 Reallocated_Event_Count 0x0032   200   200   000    Old_age   Always       -       0
197 Current_Pending_Sector  0x0032   200   200   000    Old_age   Always       -       0
198 Offline_Uncorrectable   0x0030   200   200   000    Old_age   Offline      -       0
199 UDMA_CRC_Error_Count    0x0032   200   200   000    Old_age   Always       -       0
200 Multi_Zone_Error_Rate   0x0008   200   200   000    Old_age   Offline      -       0

SMART Error Log Version: 1
No Errors Logged

SMART Self-test log structure revision number 1
Num  Test_Description    Status                  Remaining  LifeTime(hours)  LBA_of_first_error
# 1  Short offline       Completed without error       00%      9371         -
# 2  Short offline       Completed without error       00%      9347         -
# 3  Short offline       Completed without error       00%      9323         -
# 4  Short offline       Completed without error       00%      9300         -
# 5  Short offline       Completed without error       00%      9275         -
# 6  Short offline       Completed without error       00%      9251         -
# 7  Short offline       Completed without error       00%      9228         -
# 8  Short offline       Completed without error       00%      9204         -
# 9  Short offline       Completed without error       00%      9180         -
#10  Short offline       Completed without error       00%      9155         -
#11  Short offline       Completed without error       00%      9132         -
#12  Short offline       Completed without error       00%      9108         -
#13  Short offline       Completed without error       00%      9084         -
#14  Short offline       Completed without error       00%      9060         -
#15  Short offline       Completed without error       00%      9036         -
#16  Short offline       Completed without error       00%      9012         -
#17  Short offline       Completed without error       00%      8988         -
#18  Short offline       Completed without error       00%      8964         -
#19  Short offline       Completed without error       00%      8940         -
#20  Short offline       Completed without error       00%      8916         -
#21  Short offline       Completed without error       00%      8892         -

SMART Selective self-test log data structure revision number 1
 SPAN  MIN_LBA  MAX_LBA  CURRENT_TEST_STATUS
    1        0        0  Not_testing
    2        0        0  Not_testing
    3        0        0  Not_testing
    4        0        0  Not_testing
    5        0        0  Not_testing
Selective self-test flags (0x0):
  After scanning selected spans, do NOT read-scan remainder of disk.
If Selective self-test is pending on power-up, resume after 0 minute delay.

smartctl version 5.38 [x86_64-unknown-linux-gnu] Copyright (C) 2002-8 Bruce Allen
Home page is http://smartmontools.sourceforge.net/

=== START OF INFORMATION SECTION ===
Device Model:     WDC WD5000AADS-00L4B1
Serial Number:    WD-WCAUK1174766
Firmware Version: 05.04C05
User Capacity:    500,107,862,016 bytes
Device is:        Not in smartctl database [for details use: -P showall]
ATA Version is:   8
ATA Standard is:  Exact ATA specification draft version not indicated
Local Time is:    Mon May 30 06:45:01 2011 CEST
SMART support is: Available - device has SMART capability.
SMART support is: Enabled

=== START OF READ SMART DATA SECTION ===
SMART overall-health self-assessment test result: PASSED

General SMART Values:
Offline data collection status:  (0x84)	Offline data collection activity
					was suspended by an interrupting command from host.
					Auto Offline Data Collection: Enabled.
Self-test execution status:      (   0)	The previous self-test routine completed
					without error or no self-test has ever 
					been run.
Total time to complete Offline 
data collection: 		 (11400) seconds.
Offline data collection
capabilities: 			 (0x7b) SMART execute Offline immediate.
					Auto Offline data collection on/off support.
					Suspend Offline collection upon new
					command.
					Offline surface scan supported.
					Self-test supported.
					Conveyance Self-test supported.
					Selective Self-test supported.
SMART capabilities:            (0x0003)	Saves SMART data before entering
					power-saving mode.
					Supports SMART auto save timer.
Error logging capability:        (0x01)	Error logging supported.
					General Purpose Logging supported.
Short self-test routine 
recommended polling time: 	 (   2) minutes.
Extended self-test routine
recommended polling time: 	 ( 133) minutes.
Conveyance self-test routine
recommended polling time: 	 (   5) minutes.
SCT capabilities: 	       (0x303f)	SCT Status supported.
					SCT Feature Control supported.
					SCT Data Table supported.

SMART Attributes Data Structure revision number: 16
Vendor Specific SMART Attributes with Thresholds:
ID# ATTRIBUTE_NAME          FLAG     VALUE WORST THRESH TYPE      UPDATED  WHEN_FAILED RAW_VALUE
  1 Raw_Read_Error_Rate     0x002f   200   200   051    Pre-fail  Always       -       0
  3 Spin_Up_Time            0x0027   133   130   021    Pre-fail  Always       -       6325
  4 Start_Stop_Count        0x0032   100   100   000    Old_age   Always       -       52
  5 Reallocated_Sector_Ct   0x0033   200   200   140    Pre-fail  Always       -       0
  7 Seek_Error_Rate         0x002e   200   200   000    Old_age   Always       -       0
  9 Power_On_Hours          0x0032   083   083   000    Old_age   Always       -       12874
 10 Spin_Retry_Count        0x0032   100   253   000    Old_age   Always       -       0
 11 Calibration_Retry_Count 0x0032   100   253   000    Old_age   Always       -       0
 12 Power_Cycle_Count       0x0032   100   100   000    Old_age   Always       -       50
192 Power-Off_Retract_Count 0x0032   200   200   000    Old_age   Always       -       4
193 Load_Cycle_Count        0x0032   200   200   000    Old_age   Always       -       52
194 Temperature_Celsius     0x0022   109   104   000    Old_age   Always       -       38
196 Reallocated_Event_Count 0x0032   200   200   000    Old_age   Always       -       0
197 Current_Pending_Sector  0x0032   200   200   000    Old_age   Always       -       0
198 Offline_Uncorrectable   0x0030   200   200   000    Old_age   Offline      -       0
199 UDMA_CRC_Error_Count    0x0032   200   200   000    Old_age   Always       -       0
200 Multi_Zone_Error_Rate   0x0008   200   200   000    Old_age   Offline      -       0

SMART Error Log Version: 1
No Errors Logged

SMART Self-test log structure revision number 1
Num  Test_Description    Status                  Remaining  LifeTime(hours)  LBA_of_first_error
# 1  Short offline       Completed without error       00%     12850         -
# 2  Short offline       Completed without error       00%     12826         -
# 3  Short offline       Completed without error       00%     12801         -
# 4  Short offline       Completed without error       00%     12778         -
# 5  Short offline       Completed without error       00%     12754         -
# 6  Short offline       Completed without error       00%     12730         -
# 7  Short offline       Completed without error       00%     12706         -
# 8  Short offline       Completed without error       00%     12682         -
# 9  Short offline       Completed without error       00%     12658         -
#10  Short offline       Completed without error       00%     12634         -
#11  Short offline       Completed without error       00%     12610         -
#12  Short offline       Completed without error       00%     12586         -
#13  Short offline       Completed without error       00%     12562         -
#14  Short offline       Completed without error       00%     12538         -
#15  Short offline       Completed without error       00%     12514         -
#16  Short offline       Completed without error       00%     12490         -
#17  Short offline       Completed without error       00%     12466         -
#18  Short offline       Completed without error       00%     12442         -
#19  Short offline       Completed without error       00%     12418         -
#20  Short offline       Completed without error       00%     12395         -
#21  Short offline       Completed without error       00%     12371         -

SMART Selective self-test log data structure revision number 1
 SPAN  MIN_LBA  MAX_LBA  CURRENT_TEST_STATUS
    1        0        0  Not_testing
    2        0        0  Not_testing
    3        0        0  Not_testing
    4        0        0  Not_testing
    5        0        0  Not_testing
Selective self-test flags (0x0):
  After scanning selected spans, do NOT read-scan remainder of disk.
If Selective self-test is pending on power-up, resume after 0 minute delay.

..start selftest...
smartctl version 5.38 [x86_64-unknown-linux-gnu] Copyright (C) 2002-8 Bruce Allen
Home page is http://smartmontools.sourceforge.net/

=== START OF OFFLINE IMMEDIATE AND SELF-TEST SECTION ===
Sending command: "Execute SMART Short self-test routine immediately in off-line mode".
Drive command "Execute SMART Short self-test routine immediately in off-line mode" successful.
Testing has begun.
Please wait 2 minutes for test to complete.
Test will complete after Mon May 30 06:47:01 2011

Use smartctl -X to abort test.
smartctl version 5.38 [x86_64-unknown-linux-gnu] Copyright (C) 2002-8 Bruce Allen
Home page is http://smartmontools.sourceforge.net/

=== START OF OFFLINE IMMEDIATE AND SELF-TEST SECTION ===
Sending command: "Execute SMART Short self-test routine immediately in off-line mode".
Drive command "Execute SMART Short self-test routine immediately in off-line mode" successful.
Testing has begun.
Please wait 2 minutes for test to complete.
Test will complete after Mon May 30 06:47:01 2011

Use smartctl -X to abort test.
..waiting 3 min...
smartctl version 5.38 [x86_64-unknown-linux-gnu] Copyright (C) 2002-8 Bruce Allen
Home page is http://smartmontools.sourceforge.net/

=== START OF READ SMART DATA SECTION ===
SMART Self-test log structure revision number 1
Num  Test_Description    Status                  Remaining  LifeTime(hours)  LBA_of_first_error
# 1  Short offline       Completed without error       00%      9395         -
# 2  Short offline       Completed without error       00%      9371         -
# 3  Short offline       Completed without error       00%      9347         -
# 4  Short offline       Completed without error       00%      9323         -
# 5  Short offline       Completed without error       00%      9300         -
# 6  Short offline       Completed without error       00%      9275         -
# 7  Short offline       Completed without error       00%      9251         -
# 8  Short offline       Completed without error       00%      9228         -
# 9  Short offline       Completed without error       00%      9204         -
#10  Short offline       Completed without error       00%      9180         -
#11  Short offline       Completed without error       00%      9155         -
#12  Short offline       Completed without error       00%      9132         -
#13  Short offline       Completed without error       00%      9108         -
#14  Short offline       Completed without error       00%      9084         -
#15  Short offline       Completed without error       00%      9060         -
#16  Short offline       Completed without error       00%      9036         -
#17  Short offline       Completed without error       00%      9012         -
#18  Short offline       Completed without error       00%      8988         -
#19  Short offline       Completed without error       00%      8964         -
#20  Short offline       Completed without error       00%      8940         -
#21  Short offline       Completed without error       00%      8916         -

smartctl version 5.38 [x86_64-unknown-linux-gnu] Copyright (C) 2002-8 Bruce Allen
Home page is http://smartmontools.sourceforge.net/

=== START OF READ SMART DATA SECTION ===
SMART Self-test log structure revision number 1
Num  Test_Description    Status                  Remaining  LifeTime(hours)  LBA_of_first_error
# 1  Short offline       Completed without error       00%     12874         -
# 2  Short offline       Completed without error       00%     12850         -
# 3  Short offline       Completed without error       00%     12826         -
# 4  Short offline       Completed without error       00%     12801         -
# 5  Short offline       Completed without error       00%     12778         -
# 6  Short offline       Completed without error       00%     12754         -
# 7  Short offline       Completed without error       00%     12730         -
# 8  Short offline       Completed without error       00%     12706         -
# 9  Short offline       Completed without error       00%     12682         -
#10  Short offline       Completed without error       00%     12658         -
#11  Short offline       Completed without error       00%     12634         -
#12  Short offline       Completed without error       00%     12610         -
#13  Short offline       Completed without error       00%     12586         -
#14  Short offline       Completed without error       00%     12562         -
#15  Short offline       Completed without error       00%     12538         -
#16  Short offline       Completed without error       00%     12514         -
#17  Short offline       Completed without error       00%     12490         -
#18  Short offline       Completed without error       00%     12466         -
#19  Short offline       Completed without error       00%     12442         -
#20  Short offline       Completed without error       00%     12418         -
#21  Short offline       Completed without error       00%     12395         -



